Title,Date,End,Description,Media,Place,Location,Location_Original,Source,Source URL
"John Brown launches attack on federal arsenal at Harpers Ferry, Virginia in order to gather guns to free slave labor.",16/10/1859,,"<p>On October 16, 1859, radical Republican John Brown and a small band of followers, both white and black, launched a violent attack against the American system of slave labor at Harpers Ferry, Virginia (today West Virginia). While unsuccessful (and insane if one assumes he wanted something other than martyrdom), Brown’s raid did more than almost anything else in the 1850s to highlight the differences between northern and southern labor systems and the moral bankruptcy of the latter. Agree or disagree with his actions, he made it almost impossible for northern whites to claimed to be abolitionists to hide behind gradual programs or a vague hope for the future. For southern whites, it was a call to arms against increasingly radical anti-slavery forces in the north and the desires of slaves to escape. For African-Americans, at least the few who had the opportunity to take advantage of Brown’s actions, it was the deliverance from a hell of forced labor and degradation for which they had prayed. </p><p><a href=""http://www.lawyersgunsmoneyblog.com/2013/10/this-day-in-labor-history-october-16-1859"">Read whole article</a></p>",http://lawyersgunsmon.wpengine.com/wp-content/uploads/2013/10/brown_john2.jpg,"Harpers Ferry, WV","39.323418,-77.7319766",,,
Erie Canal opens after over 1000 workers die building it.,26/10/1825,,"<p>On October 26, 1825, the Erie Canal opened, eight years after construction commenced. This engineering marvel would have enormous impacts on the future of American work, including spurring ever-greater industrialization, helping cement the Great Lakes states as a center of American industrialization, and ensuring New York would be the long-term center of American commerce. It also came at a cost of over 1000 dead workers. </p><p><a href=""http://www.lawyersgunsmoneyblog.com/2013/10/this-day-in-labor-history-october-26-1825"">Read whole article</a></p>",http://lawyersgunsmon.wpengine.com/wp-content/uploads/2013/10/Excavation-Lockport.jpg,Erie Canal,"43.0227627,-78.88143337",,,
Nicholas Farwell’s hand is crushed working on railroad,30/10/1837,,"<p>On October 30, 1837, Nicholas Farwell, a train engineer toiling for the Boston and Worcester Rail Road Corporation fell off a train while at work and had his hand crushed by the train. Farwell sued the company for damages. The 1842 decision by the Massachusetts Supreme Court set into place the doctrine of worker risk. This decision set a vitally important precedent in American labor history that the worker voluntarily took on risk when he or she agreed to be employed on the job. Over the next century, tens thousands of Americans died on the job with employers doing nothing. </p><p><a href=""http://www.lawyersgunsmoneyblog.com/2013/10/this-day-in-labor-history-october-30-1837"">Read whole article</a></p>",,Massachusetts,"42.3788774,-72.032366",,,
Cherry Mine Fire in Illinois kills 259 workers.,13/11/1909,,"<p>On November 13, 1909, at the Cherry Mine in Cherry, Illinois, a coal car filled with hay for the mules who worked underground rolled down a track. Earlier that week, an electrical outage had struck the mine. The miners were then forced to use torches, kerosene lamps, and other flammable forms of lighting while at work. Hay sticking out from the edge of the car brushed up against a torch and caught fire. The car moved down the track, spreading the fire. As the mine caught fire, the company closed the oxygen supply to the mine. This tampered down the fire but also began suffocating the workers. 259 miners died, the worst coal mine fire in U.S. history. </p><p><a href=""http://www.lawyersgunsmoneyblog.com/2013/11/this-day-in-labor-history-november-13-1909"">Read whole article</a></p>",,"Cherry, Illinois","41.4269787,-89.213419",,,
WTO protests begin in Seattle.,30/11/1999,,"<p>On November 30, 1999, protests began in Seattle, Washington against the World Trade Organization. The WTO meetings offered unions, environmentalists, and various social and economic justice activists from around the world a forum to voice their rejection of the neoliberal free trade agreements of the late 20th century that had undermined American unionism, allowed corporations the mobility to flee meaningful labor agreements or environmental restrictions, thrown millions of farmers and indigenous peoples off their lands as cheap American agricultural goods flooded world markets, and stripped people around the world of the ability to influence the economic conditions of their nations and the social and economic safety nets created in the twentieth century to provide people with a modicum of dignity. These protests raised an important hue and cry against this injustice, but became most known for the violence that took place on the streets. </p><p><a href=""http://www.lawyersgunsmoneyblog.com/2013/11/this-day-in-labor-history-november-30-1999"">Read whole article</a></p>",,"Seattle, Washington","47.6038321,-122.3300624",,,
American Federation of Labor founded in Columbus,08/12/1886,,"<p>On December 8, 1886, the American Federation of Labor formed at a meeting of union officials in Columbus, Ohio. The most successful labor federation in American history, the AFL has long had its critics on both the left and right, but ultimately its founding president Samuel Gompers understood the realities of Gilded Age politics and how to negotiate the best possible deal for workers in that atmosphere. </p><p><a href=""http://www.lawyersgunsmoneyblog.com/2013/12/this-day-in-labor-history-december-8-1886"">Read whole article</a></p>",http://lawyersgunsmon.wpengine.com/wp-content/uploads/2013/12/AFL-label.jpg,"Columbus, Ohio","39.9622601,-83.0007065",,,
Curt Flood sends letter to Major League Baseball demanding free agency.,24/12/1969,,"<p>Major League Baseball had long exploited its players. The key tool for this was the reserve clause. This gave owners total control over player labor, allowing the movement of players from team to team only through trade, release, or retirement. In other words, when the owner was ready to dispense with them or the player decided to quit. </p><p><a href=""http://www.lawyersgunsmoneyblog.com/2013/12/this-day-in-labor-history-december-24-1969"">Read whole article</a></p>",http://lawyersgunsmon.wpengine.com/wp-content/uploads/2013/12/barra_flood.jpg,"St. Louis, IL","38.6268039,-90.1994097",,,
Federal Coal Mine Health and Safety Act signed.,30/12/1969,,"<p>On December 30, 1969, Richard Nixon signed the Federal Coal Mine Health and Safety Act into law. The first comprehensive legislation in American history to protect the lives of coal miners, it came only after tens of thousands of deaths in mine accidents and even more deaths from black lung and other breathing problems of the mines. </p><p><a href=""http://www.lawyersgunsmoneyblog.com/2013/12/this-day-in-labor-history-december-30-1969"">Read whole article</a></p>",,,#N/A,,,
Ellis Island opens.,01/01/1892,,"<p>On January 1, 1892, Ellis Island opened to process the millions of immigrants entering New York. Although certainly not only entry point for immigrants, it was the primary location where the immigrants needed to labor in American factories first experienced the country. Annie Moore, an Irish immigrant, was the first person to go through processing that morning, one of over 12 million who would enter the country from this point before the facility closed in 1954. </p><p><a href=""http://www.lawyersgunsmoneyblog.com/2014/01/this-day-in-labor-history-january-1-1892"">Read whole article</a></p>",http://lawyersgunsmon.wpengine.com/wp-content/uploads/2014/01/583px-Ellis_Island_arrivals.jpg,"Ellis Island, NY","42.4253505,-76.3813253",,,
German Coast slave rebellion begins in Louisiana.,08/01/1811,,"<p>On January 8, 1811, the largest armed slave uprising in U.S. history took place. The German Coast Uprising in Louisiana had up to 500 participants marching to New Orleans to attempt a Haitian Revolution in the United States. Only 2 whites died in this uprising, showing the extreme difficulty any slave revolt had in succeeding or even making a dent in the slave power within the United States. Yet for the significance of this event, it is almost completely unknown in popular American history, even compared to the rest of slavery history. </p><p><a href=""http://www.lawyersgunsmoneyblog.com/2014/01/this-day-in-labor-history-january-8-1811"">Read whole article</a></p>",,Louisiana,"30.8703881,-92.007126",,,
Tompkins Square Riot.,13/01/1874,,"<p>On January 13, 1874, thousands of unemployed New Yorkers met in Tompkins Square Park to protest their unemployment and poverty. There, the police would beat them in the first large-scale state crackdown of the American white poor in the nation’s history. </p><p><a href=""http://www.lawyersgunsmoneyblog.com/2014/01/this-day-in-labor-history-january-13-1874"">Read whole article</a></p>",http://lawyersgunsmon.wpengine.com/wp-content/uploads/2014/01/800px-Tompkins_square_riot_1874.jpg,"New York City, NY","40.7127281,-74.0060152",,,
Publication of Looking Backward.,14/01/1888,,"<p>On January 14, 1888, Edward Bellamy’s <em>Looking Backward, 2000-1887</em> was published. One of the two most influential books in American labor history (with <em>The Jungle</em> as the other), Bellamy’s treatise tapped into the dreams of thousands of Americans who found the promises of the post-Civil War economy a lie and were desperate for alternatives to the reality of Gilded Age capitalism. </p><p><a href=""http://www.lawyersgunsmoneyblog.com/2014/01/this-day-in-labor-history-january-14-1888"">Read whole article</a></p>",http://lawyersgunsmon.wpengine.com/wp-content/uploads/2014/01/LookingBackward.jpg,,#N/A,,,
Ralph Chaplin writes “Solidarity Forever.”,15/01/1915,,"<p>On the night of January 15, 1915, the IWW writer and propagandist Ralph Chaplin  wrote the song “Solidarity Forever.” The song is emblematic of Wobbly culture. If there’s one thing the IWW did well, it was culture creation. This culture creation has done a great deal to give them outsized influence compared to their real accomplishments in American labor and radical history, continuing to make the union and its ideas relevant to activists today. </p><p><a href=""http://www.lawyersgunsmoneyblog.com/2014/01/this-day-in-labor-history-january-15-1915"">Read whole article</a></p>",http://lawyersgunsmon.wpengine.com/wp-content/uploads/2014/01/Chaplin-ralph.jpg,,#N/A,,,
Lowell Female Labor Reform Association organizes and forces Massachusetts to investigate conditions in the Lowell textile mills.,13/02/1845,,"<p>On February 13, 1845, the Lowell Female Labor Reform Association forced the state of Massachusetts to hold hearings on reducing the work day in the state’s textile mills to 10 hours a day. The LFLRA had collected 2000 signatures to put pressure on the textile mill owners and state to improve the conditions in the factories. While the ability to interest state politicians in the conditions of workers was a success of sorts, not only did the workers fail to win, but this is a transitional moment in an industry that would soon replace these women with workers who had access to far less power to protest the conditions of their work, something that continues apparel companies have aimed for ever since. </p><p><a href=""http://www.lawyersgunsmoneyblog.com/2014/02/this-day-in-labor-history-february-13-1845"">Read whole article</a></p>",http://lawyersgunsmon.wpengine.com/wp-content/uploads/2014/02/9843500.jpg,"Lowell, MA","42.6334247,-71.3161718",,,
"Theodore Roosevelt and Japanese government agree to Gentlemen’s Agreement, ends most Japanese immigration to the U.S. after west coast labor protests",15/02/1907,,"<p>West Coast employers wanted cheap labor. The region received very little immigration from southern and eastern Europe like the east, so they had to be creative. Originally, western employers hired the Chinese to do menial work, but the angry response from west coast labor that led to the Chinese Exclusion Act, the first major legislative victory for organized labor in the nation’s history, ended that supply in 1882. So employers turned to Japan. Japan in the 1880s was modernizing rapidly, but was still poor. Encouraging migration was a useful way to undermine internal social problems. Almost immediately after 1882, Japanese migration to the United States soared. Much of this was to the sugar plantations of the American soon-to-be colony in Hawaii, but large numbers came to California, Oregon, and Washington as well. There they would serve as a key part of the low-wage labor force for the next sixty years. </p><p><a href=""http://www.lawyersgunsmoneyblog.com/2014/02/this-day-in-labor-history-february-15-1907"">Read whole article</a></p>",http://lawyersgunsmon.wpengine.com/wp-content/uploads/2014/02/japanese_americans_1.jpg,,#N/A,,,
"Pittston Coal Company slurry dam collapses in Logan County, West Virginia, 125 dead.",26/02/1972,,"<p>On February 26, 1972, a Pittston Coal Company slurry dam collapsed in Logan County, West Virginia. The ensuing flood of coal slurry would kill 125 people and demonstrate once again the horrific contempt the coal industry has for the people of West Virginia. </p><p><a href=""http://www.lawyersgunsmoneyblog.com/2014/02/this-day-in-labor-history-february-26-1972"">Read whole article</a></p>",,West Virginia,"38.4758406,-80.8408415",,,
Davis-Bacon Act signed.,03/03/1931,,"<p>This post is a special request from Anna in PDX to help her work out some thorny issues she faces in her local. If this series can be of use to your local or organizing needs, drop me a line. </p><p>On March 3, 1931, President Herbert Hoover signed the Davis-Bacon Act, establishing a requirement for the government to pay local prevailing wages on public works projects. Even since its passage, it’s been tainted with an accusation of racism, which will be the subject of today’s post, as we try to untangle the complex knot of race and labor in American history.</p><p><a href=""http://www.lawyersgunsmoneyblog.com/2014/03/this-day-in-labor-history-march-3-1931"">Read whole article</a></p>",http://lawyersgunsmon.wpengine.com/wp-content/uploads/2014/02/800px-Bacon_Davis.jpg,,#N/A,,,
LaFollette Seamen’s Act signed,04/03/1915,,"<p>On March 4, 1915, President Woodrow Wilson signed the LaFollette Seamen’s Act, creating standards for working conditions on boats that the U.S. would enforce on all ships stopping at American ports, whether under American flags or not. It was not only a major early victory for American labor but is strong evidence behind the assertion that Woodrow Wilson is the most pro-union president in American history before FDR. </p><p><a href=""http://www.lawyersgunsmoneyblog.com/2014/03/this-day-in-labor-history-march-4-1915"">Read whole article</a></p>",http://lawyersgunsmon.wpengine.com/wp-content/uploads/2014/03/Furuseth-La_Follette-Steffens-1915.jpeg,,#N/A,,,
Lordstown Strike,05/03/1972,,"<p>On March 5, 1972, the workers at General Motors’ plant in Lordstown, Ohio went on strike after authorizing it two days prior. They were angry about sped-up work at their factory, but ultimately this was a young and diverse workforce angry at the degrading and mind-numbing nature of industrial work. The 3-week strike received national attention as much for the generational rebellion it summed up as the labor strife itself. Employers and union leaders both feared the “Lordstown Syndrome” that seemed to be taking over American workplaces as young workers wanted more for their lives than a lifetime on the assembly line. </p><p><a href=""http://www.lawyersgunsmoneyblog.com/2014/03/this-day-in-labor-history-march-5-1972"">Read whole article</a></p>",http://lawyersgunsmon.wpengine.com/wp-content/uploads/2014/03/30606.preview.jpg,"Lordstown, Ohi","41.165613,-80.857585",,,
Salt of the Earth premiers,14/03/1954,,"<p>On March 14, 1954, the great labor film Salt of the Earth, a fictionalized version of a 1950 Mine, Mill strike in the zinc mines of southwestern New Mexico, premiered despite being lambasted as a communist plot, subjected to police harassment, and having one of its leads deported to Mexico. </p><p><a href=""http://www.lawyersgunsmoneyblog.com/2014/03/this-day-in-labor-history-march-14-1954"">Read whole article</a></p>",,,#N/A,,,
Postal Workers go on strike,18/03/1970,,"<p>On March 18, 1970, postal workers around the nation went on strike. This illegal but pioneering strike of public sector workers not only forced the Nixon Administration to cave but ushered in a decade of working class restlessness against their own staid union officials and a decade of public sector activism that would spur an enormous growth in union organizing among public employees. </p><p><a href=""http://www.lawyersgunsmoneyblog.com/2014/03/this-day-in-labor-history-march-18-1970"">Read whole article</a></p>",http://lawyersgunsmon.wpengine.com/wp-content/uploads/2014/03/US_Postal_Strike_1970.jpg,,#N/A,,,
"Founding of Republican Party, free labor ideology",20/03/1854,,"<p>On March 20, 1854, the Republican Party was founded at a meeting in Ripon, Wisconsin. Ideas of labor, both free and slave, were central to Republican Party ideology and would have massive implications for decades, not only with the end of slavery during the Civil War, but for white labor through the Gilded Age. </p><p><a href=""http://www.lawyersgunsmoneyblog.com/2014/03/this-day-in-labor-history-march-20-1854"">Read whole article</a></p>",,"Ripon, Wisconsin","43.8424502,-88.8372972",,,
"Police tear gas strikers at Hormel plant in Austin, Minnesota",11/04/1986,,"<p>On April 11, 1986, police fired tear gas at strikers at the Hormel plant in Austin, Minnesota after UFCW Local P-9 shut down the plant by blocking the main gate to the building. 17 workers were arrested that day. The Hormel Strike was notable both for its militant local and the reluctance of the UFCW to put up a strong fight against contractual rollbacks. It also pioneered the modern corporate campaign as a labor tactic. Most importantly, the Hormel strike was a sign to the entire nation of the weakness of the labor movement by the late 1980s and the aggressive actions companies would now take to destroy their employees’ unions, a trend that has continued to the present. </p><p><a href=""http://www.lawyersgunsmoneyblog.com/2014/04/this-day-in-labor-history-april-11-1986"">Read whole article</a></p>",http://lawyersgunsmon.wpengine.com/wp-content/uploads/2014/04/strike2.jpg,"Austin, Minnesota","43.6680928,-92.9744896",,,
Toledo Auto-Lite strike begins.,12/04/1934,,"<p>The Electric Auto-Lite company made electrical starters and spark plugs at a factory in Toledo. Although we don’t think of the American Federation of Labor as organizing industrial workers–because usually they didn’t–by the early 1930s, the pressure to engage in industrial strikes was forcing the AFL to move in a limited way on this front, particularly after the passage of the National Industrial Recovery Act in 1933. So the AFL sought to organize the Auto-Lite plant, as well as several other auto plants. It had some early success, establishing temporary industrial unions at a few plants by March 1934. </p><p><a href=""http://www.lawyersgunsmoneyblog.com/2014/04/day-labor-history-april-12-1934"">Read whole article</a></p>",http://lawyersgunsmon.wpengine.com/wp-content/uploads/2014/04/11_2.jpg,"Toledo,OH","41.6786754,-83.5127283",,,
Bunker Hill Mining Company in Idaho announces policy of sterilization for women working in its lead smelter,14/04/1975,,"<p>On April 14, 1975, the Bunker Hill Mining Company in Kellogg, Idaho announced a new policy in response to worries about female workers suffering reproductive problems due to lead exposure. The company decided to require sterilization of all women working in its smelter. This was a landmark moment in the history of women working in dangerous labor, particularly in traditionally all-male industries like mining. </p><p><a href=""http://www.lawyersgunsmoneyblog.com/2014/04/day-labor-history-april-14-1975"">Read whole article</a></p>",,"Kellogg, Idaho","47.5382349,-116.1188875",,,
Works Progress Administration created.,06/05/1935,,"<p>On May 6, 1935, President Franklin Delano Roosevelt issued Executive Order 7034 creating the Works Progress Administration (WPA). Passed and funded by Congress in the Emergency Relief Appropriations Act of 1935, the WPA became among the two most important federal jobs programs of the New Deal and a model for how government investment in the economy can not only solve short-term unemployment problems but also build the infrastructure of a strong, modern nation. </p><p><a href=""http://www.lawyersgunsmoneyblog.com/2014/05/day-labor-history-may-6-1935"">Read whole article</a></p>",http://lawyersgunsmon.wpengine.com/wp-content/uploads/2014/05/WPA_Main_Image1.jpg,,#N/A,,,
Hard Hat Riot,08/05/1970,,"<p>On May 8, 1970, 200 unionized construction workers attacked an anti-war march in the wake of the Kent State shooting a few days before. The so-called Hard Hat Riot placed an image in the American mind of right-wing workers opposed to social justice that sadly remains far too prevalent today.</p><p><a href=""http://www.lawyersgunsmoneyblog.com/2014/05/day-labor-history-may-8-1970"">Read whole article</a></p>",http://lawyersgunsmon.wpengine.com/wp-content/uploads/2014/05/hardhat.jpg,New York City,"40.7127281,-74.0060152",,,
"Completion of Transcontinental Railroad, treatment of Chinese workers",10/05/1869,,"<p>While the Union Pacific relied largely on Irish labor, the Central Pacfiic hired mostly Chinese laborers to build the railroad. There were certain dangers with all railroad construction and the UP did build across the territory of still pretty powerful Native American tribes, but the land itself was slowly rising and without major physical obstacles in the way. On the other hand, the CP had to build across the Sierra Nevada and then through the difficult terrain of Nevada. It was going over the Sierra that tells the most compelling labor history of the Transcontinental Railroad. </p><p><a href=""http://www.lawyersgunsmoneyblog.com/2014/05/day-labor-history-may-10-1869"">Read whole article</a></p>",http://lawyersgunsmon.wpengine.com/wp-content/uploads/2014/05/railroad_laborers_news.jpg,"Promontory Point, Utah","37.471393,-112.2258853",,,
Coolidge signs Immigration Act of 1924,26/05/1924,,"<p>On May 26, 1924, the doors of the United States closed to most immigrants as President Calvin Coolidge signed the Immigration Act of 1924. The law set the yearly quota for a nation’s population to immigrate to the U.S. at 2% of its U.S. population in the 1890 census. Beginning in 1927, immigration would then decline even further, to 150,000 total. This law put an end to the immigrant flows to the U.S. that had provided the labor force for the nation’s stupendous industrial growth in the late nineteenth and early twentieth centuries. It also demonstrates the great discomfort many Americans had with the diversity that became a byproduct of the need for such an expanding labor force. </p><p><a href=""http://www.lawyersgunsmoneyblog.com/2014/05/day-labor-history-may-26-1924"">Read whole article</a></p>",,,#N/A,,,
Normal Rockwell publishes Rosie the Riveter cover in Saturday Evening Post,29/05/1943,,"<p>On May 29, 1943, Norman Rockwell published a cover in the<em> Saturday Evening Post</em> of a woman working an industrial job. This cover represented the millions of women entering the workforce during World War II to build the material needed to defeat the Axis. This image was part of a larger cultural phenomena referring to these women workers as Rosie the Riveter. Rosie the Riveter may not have been a real woman, but she does open an entry way to talk about a key point in American labor history: women and work in World War II.  </p><p><a href=""http://www.lawyersgunsmoneyblog.com/2014/05/day-labor-history-may-29-1943"">Read whole article</a></p>",http://lawyersgunsmon.wpengine.com/wp-content/uploads/2014/05/8d39781r.jpg,,#N/A,,,
"Celia, a slave, kills her master when he attempts to rape her",23/06/1855,,"<p>On June 23, 1855, a 19 year old slave woman named Celia murdered her master rather than allow him to rape her. She then attempted to burn his body, nearly succeeding in erasing all traces of the crime. She was arrested, convicted, and executed. This story gets at both the inhumanity of slavery and the sexual labor forced upon millions of African and African-American women during two centuries of chattel slavery in the United States. </p><p><a href=""http://www.lawyersgunsmoneyblog.com/2014/06/day-labor-history-june-23-1855"">Read whole article</a></p>",,Missouri,"38.7604815,-92.5617875",,,
FDR signs Fair Labor Standards Act,25/06/1938,,"<p>On June 25, 1938, President Franklin Delano Roosevelt signed the Fair Labor Standards Act. This groundbreaking piece of legislation, while flawed as almost all progressive legislation must be to pass Congress, set the standards of labor that defined post-war America, including minimum wages, overtime pay, and the banning of most child labor.</p><p><a href=""http://www.lawyersgunsmoneyblog.com/2014/06/day-labor-history-june-25-1938"">Read whole article</a></p>",,,#N/A,,,
