Title,Date,End,Description,Media,Place,Location,Location_Original,Source,Source URL
"Cananea Strike in Mexico, prelude to Mexican Revolution",01/06/1906,,"<p>On June 1, 1906, copper miners in the city of Cananea, Sonora, a few miles south of the U.S.-Mexico border, went on strike against the American companies dominating the mines and Porfirian Mexico. Widely seen as one of the most important events influencing the start of the Mexican Revolution in 1910, the Cananea strike is also one of the most important events in Mexican labor history. </p><p><a href=""http://www.lawyersgunsmoneyblog.com/2015/06/this-day-in-labor-history-june-1-1906"">Read whole article</a></p>",,,#N/A,,,
Los Angeles police beat SEIU members in Justice for Janitors march,15/06/1990,,"<p>On June 15, 1990, 400 striking janitors in Los Angeles who had organized with the Service Employees International Union (SEIU) and were trying to secure a contract with International Service Systems (ISS), who had the contract to clean many of the city’s downtown office buildings, were beaten by police as they attempted to cross a street. Around 90 strikers were wounded and 38 were arrested. This event galvanized support for the janitors and is an important event both in the history of Latino labor in the United States and the growth of SEIU into arguably the most powerful union in the United States during the early 21st century. </p><p><a href=""http://www.lawyersgunsmoneyblog.com/2015/06/this-day-in-labor-history-june-15-1990"">Read whole article</a></p>",,,#N/A,,,
CIA-led Guatemalan coup against Jacobo Arbenz begins with AFL support,18/06/1954,,"<p>On June 18, 1954, the CIA-trained coup against democratically elected Guatemalan president Jacobo Árbenz began, an event that crushed Guatemalan labor, happened with the complicity of the American labor movement, and significantly destabilized Guatemala, helping to create the violence that afflicts that nation and the large-scale undocumented migration to the United States today.</p><p><a href=""http://www.lawyersgunsmoneyblog.com/2015/06/this-day-in-labor-history-june-18-1954"">Read whole article</a></p>",,,#N/A,,,
Herrin Massacre,22/06/1922,,"<p>On June 22, 1922, a night and early morning of angry United Mine Workers of America members massacring strikebreakers and mine guards ended in Herrin, Illinois. Twenty-one people died, 19 of which were the strikebreakers and guards. This spasm of violence is a rare example of American labor history where workers killed more people than the forces of order. It’s also a sign of the desperation and anger of coal miners by the 1920s over the terrible treatment of themselves and their unions. Finally, the UMWA strategy of avoiding blame for this incident by blaming nonexistent communists for leading the mob proved a pioneering incident of a long history of American organized labor redbaiting. </p><p><a href=""http://www.lawyersgunsmoneyblog.com/2015/06/this-day-in-labor-history-june-19-1937"">Read whole article</a></p>",,,#N/A,,,
"Supreme Court decides Industrial Union Department AFL-CIO v. American Petroleum Institute, limiting OSHA workplace health program ",02/07/1980,,"<p>On July 2, 1980, the Supreme Court ruled in <em>Industrial Union Department AFL-CIO</em> v. <em>American Petroleum Institute</em> that the Occupational Safety and Health Administration must take economic considerations into account when issuing regulations. This 5-4 decision severely impacted the ability of the government to take an aggressive and preemptive stand against workplace health problems. </p><p><a href=""http://www.lawyersgunsmoneyblog.com/2015/07/this-day-in-labor-history-july-2-1980"">Read whole article</a></p>",http://lawyersgunsmon.wpengine.com/wp-content/uploads/2015/07/hazard.jpg,,#N/A,,,
International Labor Organization passes Freedom of Association Convention. U.S. never ratifies it.,09/07/1948,,"<p>On July 9, 1948, the International Labour Organization signed The Freedom of Association and Protection of the Right to Organise Convention. Unfortunately, the United States Senate never ratified it, showing the difficulty international standards, labor and otherwise, have always had in becoming law in the United States and the damage that can do for the effectiveness of these agreements. It also suggests just how limited labor rights really are in the United States compared to much of the world. </p><p><a href=""http://www.lawyersgunsmoneyblog.com/2015/07/this-day-in-labor-history-july-9-1948"">Read whole article</a></p>",http://lawyersgunsmon.wpengine.com/wp-content/uploads/2015/07/ilo-logo.jpg,,#N/A,,,
Steelworkers Strike of 1959 begins,15/07/1959,,"<p>On July 15, 1959, the United Steelworkers of America went on strike to protect its significant victories won after World War II in running the shop floor and empowering its members to live a middle-class lifestyle. Perhaps the most underrated event in American labor history, the steel strike of 1959 touches on many of the key labor issues of the postwar period. Combining the total number workers and length of the strike, companies lost more employee hours than any other strike in American history. It showed the height of worker power in American labor history on the shop floor and through the contract. It also demonstrated how government would still bust strikes when it could, a blast from the past and a foretaste of the future. Yet it also suggested just how far unions had come in American society, given how the USWA overcame these challenges and won. Finally, this was the end of the peak of American labor militancy.</p><p><a href=""http://www.lawyersgunsmoneyblog.com/2015/07/this-day-in-labor-history-july-15-1959"">Read whole article</a></p>",,,#N/A,,,
AFL-CIO refuses to endorse George McGovern for president,19/07/1972,,"<p>On July 19, 1972, the AFL-CIO announced its decision not to endorse George McGovern for president. This astounding decision helped doom the already floundering McGovern campaign, helping to guarantee another victory for Richard Nixon. It also placed a permanent divide between non-labor progressives in the Democratic Party and the labor movement, one that still has not been fully bridged today. The story is actually more complicated than is usually stated, because in fact a lot of unions strongly supported McGovern. </p><p><a href=""http://www.lawyersgunsmoneyblog.com/2015/07/this-day-in-labor-history-july-19-1972"">Read whole article</a></p>",,,#N/A,,,
President Carter declares Love Canal a federal emergency,07/08/1978,,"<p>On August 7, 1978, President Jimmy Carter declared a federal emergency at Love Canal, New York, in response to the discovery of massive amounts of toxins underneath a school and near a housing development for the working class who lived in the city of Niagara Falls, near Buffalo. This event was a key moment in the American working class standing up to the environmental depredations of American industry and eventually led to the creation of Superfund, the last major environmental legislation passed to address the popularly-based environmentalism of protecting people from pollution that played a major role in American politics during the 1970s.</p><p><a href=""http://www.lawyersgunsmoneyblog.com/2015/08/this-day-in-labor-history-august-7-1978"">Read whole article</a></p>",,,#N/A,,,
"Panama Canal opens, story of its workers",15/08/1914,,"<p>On August 15, 1914, the Panama Canal opened, completing one of the great engineering projects of the time, one that recreated racialized labor norms of the United States in Panama while also demonstrating how sanitary reforms could save workers lives. It also served to connect the imperial empire of labor the United States was building around the world. </p><p><a href=""http://www.lawyersgunsmoneyblog.com/2015/08/this-day-in-labor-history-august-15-1914"">Read whole article</a></p>",,,#N/A,,,
National Labor Union demands Congress implement the 8-hour day,20/08/1866,,"<p>On August 20, 1866, the National Labor Union, the first labor union federation in U.S. history, demanded Congress implement a national 8-hour day. It led to a partial and fleeting success, but the NLU story is an important moment in American labor history as it represents an early response to the onslaught of capitalism upon workers who suddenly found a class-based system developing in what was promised to be a white man’s democracy.</p><p><a href=""http://www.lawyersgunsmoneyblog.com/2015/08/this-day-in-labor-history-august-20-1866"">Read whole article</a></p>",,,#N/A,,,
The March on Washington for Jobs and Freedom,28/08/1963,,"<p>On August 28, 1963, the March on Washington for Jobs and Freedom took place in Washington, DC. This famous event is of course most often remembered for Martin Luther King’s “I Have a Dream” speech, or more specifically the 3 lines of it that conservatives have decided justify their own positions. But even among liberals and civil rights activists what is often forgotten or downplayed in the memory of this event is the central role economic issues played in it. Most of the economic agenda of the 1960s civil rights movement in fact is barely remembered. That’s a huge problem because not only were African-Americans fighting for the opportunity for economic advancement as well as to end segregation and for the vote but also because it presents an incomplete history which takes away part of the reason this movement so challenged American life. </p><p><a href=""http://www.lawyersgunsmoneyblog.com/2015/08/this-day-in-labor-history-august-28-1963"">Read whole article</a></p>",,,#N/A,,,
"Christiana Riot, runaway slaves resisting Fugitive Slave Act",11/09/1851,,"<p>On September 11, 1851, African-Americans and abolitionist whites in Christiana, Pennsylvania engaged in violent resistance against a posse of slave catchers riding up from Maryland to retrieve fugitive slaves in the town. The so-called Christiana Riot demonstrated the growing division in the nation over the use of slave labor in the aftermath of the Fugitive Slave Act of 1850 and the increasing willingness in the North to actively resist incursions to recover slaves who had freed themselves from a life of bondage. </p><p><a href=""http://www.lawyersgunsmoneyblog.com/2015/09/this-day-in-labor-history-september-11-1851"">Read whole article</a></p>",http://lawyersgunsmon.wpengine.com/wp-content/uploads/2015/09/christianariot.jpg,,#N/A,,,
Black Monday in Youngstown,19/09/1977,,"<p>On September 19, 1977, the Youngstown Sheet and Tube Company shut down its operations, laying off approximately 4100 workers. This event, which became known as Black Monday, was emblematic of the deindustrialization decimating the Youngstown economy and dooming it and cities like it to long-term decline and entrenched poverty it has not recovered from today. </p><p><a href=""http://www.lawyersgunsmoneyblog.com/2015/09/this-day-in-labor-history-september-19-1977"">Read whole article</a></p>",,,#N/A,,,
"Comanche defeated at Palo Duro Canyon, end of a work history",28/09/1874,,"<p>On September 28, 1874, the U.S. military defeated the Comanche in Palo Duro Canyon, south of modern Amarillo, Texas, largely by stealing their horse herds. This forced the Comanche to the reservations where they had refused to live by taking away the technology that defined their lives and their work. This was essentially the end of an entire way of labor for the Comanche and indicative of the importance of work to the conquest of Native Americans.</p><p><a href=""http://www.lawyersgunsmoneyblog.com/2015/09/this-day-in-labor-history-september-28-1874"">Read whole article</a></p>",,,#N/A,,,
George H.W. Bush signs Radiation Exposure Compensation Act,15/10/1990,,"<p>On October 15, 1990, President George H.W. Bush signed the Radiation Exposure Compensation Act, finally providing a path forward for some of the Cold War’s most exploited workers, Navajo uranium miners, as well as other Americans, primarily Native Americans and Mormon farmers, who had been declared expendable by the Cold War military complex and exposed against their will or without knowledge to radiation from nuclear testing and mining. Yet even this act made it very difficult for Native Americans to win claims for compensation. This history signifies just how ignored Native American workers have been throughout American history and how the Cold War saw these people as utterly expendable. </p><p><a href=""http://www.lawyersgunsmoneyblog.com/2015/10/this-day-in-labor-history-october-15-1990"">Read whole article</a></p>",,,#N/A,,,
Newark sweatshop fire kills 25 workers,26/11/1910,,"<p>On November 26, 1910, a factory building in Newark, New Jersey caught on fire, killing 25 textile workers. This should have been a call to arms for workplace safety reform, but because it was in Newark and wealthy people did not see the people making their clothing die, nothing happened. The situation would be very different after those wealthy people did see workers die precisely four months later in New York during the Triangle Fire. </p><p><a href=""http://www.lawyersgunsmoneyblog.com/2015/11/this-day-in-labor-history-november-26-1910"">Read whole article</a></p>",,,#N/A,,,
"AFL endorses federal unemployment insurance, turning its back on history of voluntarism",30/11/1932,,"<p>On November 30, 1932, the American Federation of Labor endorsed federal unemployment insurance. This was a remarkable shift for the AFL, which had long opposed any sort of government programs for workers, preferring to rely on voluntarism and negotiation to force employers to concede worker rights instead of a government which it felt it had no reason to trust. This began the broader shift toward the American labor movement relying on government as the guarantor of its rights and the rights of working people writ large. </p><p><a href=""http://www.lawyersgunsmoneyblog.com/2015/11/this-day-in-labor-history-november-30-1932"">Read whole article</a></p>",,,#N/A,,,
"Theodore Roosevelt sends U.S. Army to crush IWW strike in Goldfield, Nevada.",04/12/1907,,"<p>On December 4, 1907, President Theodore Roosevelt ordered federal troops to the gold mining town of Goldfield, Nevada to bust a strike of workers affiliated with the Industrial Workers of the World and Western Federation of Miners. This event shows both the potential of the IWW to win actions and the extent to which the government would participate in crushing what it saw as a radical threat to American institutions. </p><p><a href=""http://www.lawyersgunsmoneyblog.com/2015/12/this-day-in-labor-history-december-4-1907"">Read whole article</a></p>",,,#N/A,,,
"Moses Brown hires Samuel Slater to build a modern textile mill in Pawtucket, Rhode Island, beginning the United States’ Industrial Revolution. ",10/12/1789,,"<p>On December 10, 1789, Moses Brown, a Rhode Island businessman, hired Samuel Slater to build an English-style factory in Pawtucket, Rhode Island. This began the Industrial Revolution in the United States. </p><p><a href=""http://www.lawyersgunsmoneyblog.com/2015/12/this-day-in-labor-history-december-10-1789"">Read whole article</a></p>",,,#N/A,,,
Assassination of Brazil rubber tapper union leader and environmentalist Chico Mendes,22/12/1988,,"<p>On December 22, 1988, the Brazilian rubber worker, union leader, and environmental activist Chico Mendes was murdered by a rancher named Darcy Alves who wished to clear the Amazon rainforest where Mendes and his fellow rubber tappers worked, lived, and tried to preserve from exploitation and destruction. His assassination showed both the power Brazilian developmentalists have over those who try to conserve forests but also the connections between labor and environmental movements that exist around the world. </p><p><a href=""http://www.lawyersgunsmoneyblog.com/2015/12/this-day-in-labor-history-december-22-1988"">Read whole article</a></p>",,,#N/A,,,
Skylab astronauts go on one-day strike,28/12/1973,,"<p>Does space have a labor history? The answer is yes. On December 28, 1973, the crew of Skylab went on a one-day strike to protest their working conditions and the pressure NASA placed on them to catch up on their experiments after one of them had gotten sick. This event might not have any enormous implications for the history of the American labor movement, but is a moment indicative of the broader worker protests of the 1970s that had the potential to reinvigorate the American labor movement. </p><p><a href=""http://www.lawyersgunsmoneyblog.com/2015/12/this-day-in-labor-history-december-28-1972"">Read whole article</a></p>",,,#N/A,,,
"Lettuce workers go on strike in Imperial Valley, starts era of farmworker organizing",16/01/1961,,"<p>On January 16, 1961, lettuce workers in the Imperial Valley of California walked off the job in one of the first modern actions of agricultural worker militancy that would eventually lead to the rise of the United Farm Workers and other farmworker unions in the 1960s and 1970s.</p><p><a href=""http://www.lawyersgunsmoneyblog.com/2016/01/this-day-in-labor-history-january-16-1961"">Read whole article</a></p>",http://lawyersgunsmon.wpengine.com/wp-content/uploads/2016/01/strike_enlarge-300x225.jpg,,#N/A,,,
Pinkertons kill 14 year old boy at Jersey City coal wharves’ strike,18/01/1887,,"<p>On January 18, 1887, Pinkerton detectives killed a fourteen year old boy in Jersey City, New Jersey during a coal wharves strike. This murder, like so many of the period by the Pinkertons and other agencies developed to protect employer interests from workers, are a sign of the murderous attitude of business, police, and politicians toward American workers during the Gilded Age. Nothing is more emblematic of these attitudes than the hated Pinkertons. </p><p><a href=""http://www.lawyersgunsmoneyblog.com/2016/01/this-day-in-labor-history-january-18-1887"">Read whole article</a></p>",http://lawyersgunsmon.wpengine.com/wp-content/uploads/2016/01/list-pinkerton-private-eye.jpg,,#N/A,,,
"OCAW strike against Shell, assisted by environmental groups",23/01/1973,,"<p>On January 23, 1973, the Oil, Chemical, and Atomic Workers went on strike against Shell Oil. This strike gained unusual supporters. Environmentalists came out hard against Shell and in support of OCAW. This came about in part because of the progressive leaders of OCAW leaders, particularly Tony Mazzocchi, OCAW legislative director. This case shows the very real potential for alliances between labor and environmentalists when the two movements have meaningful conversations and act in solidarity with one another. </p><p><a href=""http://www.lawyersgunsmoneyblog.com/2016/01/this-day-in-labor-history-january-23-1973"">Read whole article</a></p>",,,#N/A,,,
"Gold discovered in California, idea of white labor in the West",24/01/1848,,"<p style=""text-align: center;""><strong>“California Gold Diggers, Mining Operations on the Western Shore of the Sacramento River,” lithograph published by Kellogg &amp; Comstock, circa 1850</strong></p><p><a href=""http://www.lawyersgunsmoneyblog.com/2016/01/this-day-in-labor-history-january-24-1848"">Read whole article</a></p>",http://lawyersgunsmon.wpengine.com/wp-content/uploads/2016/01/california_gold_diggers.jpg,,#N/A,,,
Yale graduate students go on strike,17/02/1992,,"<p>On February 17, 1992, graduate students at Yale University went on strike. This strike, one of the most prominent in the history of organizing graduate students, is a useful window into one of the most important sectors of labor organizing over the last three decades and indicative of the tremendous difficulty in organizing private workplaces in any sector in those same three decades. </p><p><a href=""http://www.lawyersgunsmoneyblog.com/2016/02/this-day-in-labor-history-february-17-1992"">Read whole article</a></p>",,,#N/A,,,
FDR nominates Frances Perkins to be Secretary of Labor,04/03/1933,,"<p>On March 4, 1933, the newly inaugurated president Franklin Delano Roosevelt nominated Frances Perkins as Secretary of Labor. This first female cabinet member in American history (the second wouldn’t come until the <del datetime=""2016-03-04T17:07:26+00:00"">Carter</del> Eisenhower administration), Perkins was a remarkable figure who dedicated her life to improving the lives of working Americans. </p><p><a href=""http://www.lawyersgunsmoneyblog.com/2016/03/this-day-in-labor-history-march-4-1933"">Read whole article</a></p>",,,#N/A,,,
Film adaptation of The Grapes of Wrath released,15/03/1940,,"<p>On March 15, 1940, John Ford’s film version of John Steinbeck’s<em> The Grapes of Wrath,</em> was released to universal acclaim. This was perhaps the greatest moment of the cultural left during the Great Depression. Of all the New Deal-era art that broadly made up the Popular Front, none were more well-remembered and beloved than the book and film versions of <em>The Grapes of Wrath</em>, despite and possibly because neither Ford nor Steinbeck was closely associated with that movement. </p><p><a href=""http://www.lawyersgunsmoneyblog.com/2016/03/this-day-in-labor-history-march-15-1940"">Read whole article</a></p>",http://lawyersgunsmon.wpengine.com/wp-content/uploads/2016/03/grapes-of-wrath.jpg,,#N/A,,,
"Hawk’s Nest tunnel project in West Virginia starts, leading to mass deaths from silicosis",30/03/1930,,"<p>On March 30, 1930, the Hawk’s Nest tunnel project near Gauley Bridge, West Virginia began. This tunnel was designed to divert the New River to help Union Carbide increase its energy efficiency at a downstream plant. However, this mountain contained an unusual amount of silica. The largely African-American workers were not given any protection. While in normal cases, it takes years for silicosis to develop and  kill a worker, of the 3000 workers, perhaps up to 1000 died of silicosis, some within a year. This is one of the more horrifying workplace safety disasters in American history, one heavily conditioned by racial prejudice. </p><p><a href=""http://www.lawyersgunsmoneyblog.com/2016/03/this-day-in-labor-history-march-30-1930"">Read whole article</a></p>",http://lawyersgunsmon.wpengine.com/wp-content/uploads/2016/03/Hawks-Nest-Tunnel.png,,#N/A,,,
End of the Civil War,09/04/1865,,"<p><em><br/>
This post should have gone up on April 9, but sometimes, a professor can become so convinced of a piece of trivia like a date that said professor doesn’t actually look it up and then finds out it is wrong. Speaking of a friend of course.</em> </p><p><a href=""http://www.lawyersgunsmoneyblog.com/2016/04/this-day-in-labor-history-april-14-1865"">Read whole article</a></p>",http://lawyersgunsmon.wpengine.com/wp-content/uploads/2016/04/HH-152.jpg,,#N/A,,,
FDR orders Montgomery Ward to accept union or face government seizure after it refuses to recognize union,27/04/1944,,"<p>On April 27, 1944, Attorney General Francis Biddle arrived in Chicago to order Montgomery Ward head Sewell Avery to either extend his workers’ contract so they would not strike during the war or have his company seized and run by the American government. When Avery refused, Biddle had the military physically remove Avery from Montgomery Ward offices and the process began that led to the government seizing the workplace. This remarkable incident shines a light on a number of major issues concerning organized labor, corporations, and government during World War II. </p><p><a href=""http://www.lawyersgunsmoneyblog.com/2016/04/this-day-in-labor-history-april-27-1944"">Read whole article</a></p>",http://lawyersgunsmon.wpengine.com/wp-content/uploads/2016/04/chi-150carriedout20080819100625.jpg,,#N/A,,,
"Land for Drop City purchased, a window into the counterculture and work ",03/05/1965,,"<p>On May 3, 1965, Gene Bernofsky, JoAnn Bernofsky, Richard Kallweit, and Clark Richart bought a 7-acre piece of land north of Trinidad, Colorado. This would become known as Drop City, among the first and most important of the countercultural communes that dotted the American landscape during the late 1960s and 1970s and continuing, in a much diminished form, to the present. While itself not a particularly important day in American labor history per se, we can use this date to serve as a window into how work was organized in the counterculture, which is a meaningful topic on the subject. </p><p><a href=""http://www.lawyersgunsmoneyblog.com/2016/05/this-day-in-labor-history-may-3-1965"">Read whole article</a></p>",,,#N/A,,,
The Johnstown Flood,31/05/1889,,"<p>On May 31, 1889, the South Fork dam, on the land of the South Fork Fishing and Hunting Club above the city of Johnstown, Pennsylvania, collapsed during a heavy rainstorm. Over 2200 people died in the one of the worst disaster in American history. The Johnstown Flood is not only a horrible disaster but deeply reflective of class divisions during the Gilded Age and the complete lack of legal or moral responsibility the wealthy had toward the working class.  </p><p><a href=""http://www.lawyersgunsmoneyblog.com/2016/05/this-day-in-labor-history-may-31-1889"">Read whole article</a></p>",http://lawyersgunsmon.wpengine.com/wp-content/uploads/2016/05/Johnstown_Main_Street_1889_flood.jpg,,#N/A,,,
"Child Labor Amendment passes Senate, sent to states where it is not ratified",02/06/1924,,"<p>On June 2, 1924, a constitutional amendment to ban child labor passed the Senate and was sent out to the states for ratification. Unfortunately, the states never ratified it, although they still could today. </p><p><a href=""http://www.lawyersgunsmoneyblog.com/2016/06/this-day-in-labor-history-june-2-1924"">Read whole article</a></p>",http://lawyersgunsmon.wpengine.com/wp-content/uploads/2016/06/childlabor12.jpg,,#N/A,,,
